study_id,author_year,title,study_design,ending_year,world_region,world_subregion,country,city_state,focus,overall_cytology,pap_method,recruitment_setting,hpv_types_reported,hpv_types_tested,hpv_cat,hpv_test,test_details,num_older_wom,num_hpv_pos,num_hpv_neg,any_prev,risk_of_bias,Notes
87OH,"Giorgi Rossi et al., 2010",Prevalence of HPV high and low risk types in cervical samples from the Italian general population: a population based study,cross-sectional ,2007,Europe,Southern Europe,Italy,NA,Both,Predominantly normal ,LBC,screening,"overall, HR-HPV","6, 11, 16, 18, 26, 31, 33, 35, 39, 40, 42, 43, 44, 45, 51, 52, 53, 54, 56, 58, 59, 66, 68, 70, 73, 81, 82",II,GP5+/GP6+,"GP5+/GP6+ primed PCR, HC2
",516,24,492,0.047,low,"HCII HR HPV positive specimens were amplified and
typed with “consensus High Risk HPV genotyping kit”
(Qiagen); this system uses PCR with biotinilated GP5+/
GP6+ primers, followed by reverse Line Blot for 18 high
risk HPV types: 16, 18, 26, 31, 33, 35, 39, 45, 51, 52, 53,
56, 58, 59, 66, 68, 73 and 82."
88OH,"Giuliano et al., 2005",Human papillomavirus prevalence at the USA-Mexico border among women 40 years of age and over,cross-sectional ,2000,Americas,North America,USA,Arizona-Mexico Border,Both,Predominantly normal ,LBC,general population,"overall, HR-HPV","6, 11, 26, 40, 42,
53, 54, 55, 57, 66, 73, 82, 83, 84, 16, 18, 31,
33, 35, 39, 45, 51, 52, 56, 58, 59, 68",II,PGMY09/11,"Specimens
were tested for the presence of HPV using
the PGMY09/11 L1 consensus primer system",149,9,140,0.06,low,"Table 1, HPV+ by age group"
89O,"Giuliano et al., 2001",Human papillomavirus infection at the United States-Mexico border: implications for cervical cancer prevention and control,cross-sectional ,1998,Americas,North America,USA,Arizona-Mexico Border,Both,Predominantly normal ,conventional,clinical setting ,"overall, HR-HPV","6, 11, 16, 18, 26, 31, 33, 35, 39, 40, 42, 45,
51, 52, 53, 54, 55, 56, 57, 58, 59, 66, 68, 73, 82, 83, 84",II,PGMY09/11,PGMY09/11 L1 consensus primer system. HPV genotyping was conducted using the reverse line blot method on all samples that were positive by PCR. This detection method uses the HPV L1 consensus PCR products labeled with biotin to detect 27 HPV types.,68,3,65,0.044,high,Table 3 for HPV+ by age group
90OH,"Jin et al., 2010","Age-specific prevalence of human papillomavirus by grade of
cervical cytology in Tibetan women",cross-sectional ,2007,Asia,Eastern Asia,China,Tibet,Both,Predominantly normal ,LBC,general population,"overall, HR-HPV","6, 11, 16, 18, 31, 33, 35, 39, 42, 43, 44, 45, 51, 52, 53, 56, 58, 59, 66",II,other PCR,"HPV GenoArray Test Kit (HyBribio Limited，Hong Kong, China). HybriBio’s proprietary flowthrough hybridization
technique was used to detect 21 HPV genotypes",243,22,221,0.091,low,Table 2 for overall and HR-HPV+ by age group